id,title,abstract,pdf_url
2509.09534v1,ProDiGy: Proximity- and Dissimilarity-Based Byzantine-Robust Federated Learning,"Federated Learning (FL) emerged as a widely studied paradigm for distributed
learning. Despite its many advantages, FL remains vulnerable to adversarial
attacks, especially under data heterogeneity. We propose a new Byzantine-robust
FL algorithm called ProDiGy. The key novelty lies in evaluating the client
gradients using a joint dual scoring system based on the gradients' proximity
and dissimilarity. We demonstrate through extensive numerical experiments that
ProDiGy outperforms existing defenses in various scenarios. In particular, when
the clients' data do not follow an IID distribution, while other defense
mechanisms fail, ProDiGy maintains strong defense capabilities and model
accuracy. These findings highlight the effectiveness of a dual perspective
approach that promotes natural similarity among honest clients while detecting
suspicious uniformity as a potential indicator of an attack.",http://arxiv.org/pdf/2509.09534v1
2509.09533v1,Bioluminescence tomography: A new regularized shape optimization method,"In this paper, we investigate an inverse source problem arising in
bioluminescence tomography (BLT), where the objective is to recover both the
support and intensity of the light source from boundary measurements. A shape
optimization framework is developed, in which the source strength and its
support are decoupled through first-order optimality conditions. To enhance the
stability of the reconstruction, we incorporate a parameter-dependent coupled
complex boundary method(CCBM) scheme together with perimeter and volume
regularizations. The level-set representation naturally accommodates
topological changes, enabling the reconstruction of multiple, closely located,
or nested sources. Theoretical justifications are provided, and a series of
numerical experiments are conducted to validate the proposed method. The
results demonstrate the robustness, accuracy, and noise-resistance of the
algorithm, as well as its advantages over existing approaches.",http://arxiv.org/pdf/2509.09533v1
2509.09527v1,Generative Diffusion Contrastive Network for Multi-View Clustering,"In recent years, Multi-View Clustering (MVC) has been significantly advanced
under the influence of deep learning. By integrating heterogeneous data from
multiple views, MVC enhances clustering analysis, making multi-view fusion
critical to clustering performance. However, there is a problem of low-quality
data in multi-view fusion. This problem primarily arises from two reasons: 1)
Certain views are contaminated by noisy data. 2) Some views suffer from missing
data. This paper proposes a novel Stochastic Generative Diffusion Fusion (SGDF)
method to address this problem. SGDF leverages a multiple generative mechanism
for the multi-view feature of each sample. It is robust to low-quality data.
Building on SGDF, we further present the Generative Diffusion Contrastive
Network (GDCN). Extensive experiments show that GDCN achieves the
state-of-the-art results in deep MVC tasks. The source code is publicly
available at https://github.com/HackerHyper/GDCN.",http://arxiv.org/pdf/2509.09527v1
2509.09526v1,Region-Specific Audio Tagging for Spatial Sound,"Audio tagging aims to label sound events appearing in an audio recording. In
this paper, we propose region-specific audio tagging, a new task which labels
sound events in a given region for spatial audio recorded by a microphone
array. The region can be specified as an angular space or a distance from the
microphone. We first study the performance of different combinations of
spectral, spatial, and position features. Then we extend state-of-the-art audio
tagging systems such as pre-trained audio neural networks (PANNs) and audio
spectrogram transformer (AST) to the proposed region-specific audio tagging
task. Experimental results on both the simulated and the real datasets show the
feasibility of the proposed task and the effectiveness of the proposed method.
Further experiments show that incorporating the directional features is
beneficial for omnidirectional tagging.",http://arxiv.org/pdf/2509.09526v1
2509.09524v1,DeMeVa at LeWiDi-2025: Modeling Perspectives with In-Context Learning and Label Distribution Learning,"This system paper presents the DeMeVa team's approaches to the third edition
of the Learning with Disagreements shared task (LeWiDi 2025; Leonardelli et
al., 2025). We explore two directions: in-context learning (ICL) with large
language models, where we compare example sampling strategies; and label
distribution learning (LDL) methods with RoBERTa (Liu et al., 2019b), where we
evaluate several fine-tuning methods. Our contributions are twofold: (1) we
show that ICL can effectively predict annotator-specific annotations
(perspectivist annotations), and that aggregating these predictions into soft
labels yields competitive performance; and (2) we argue that LDL methods are
promising for soft label predictions and merit further exploration by the
perspectivist community.",http://arxiv.org/pdf/2509.09524v1
2509.09522v1,Towards Explainable Job Title Matching: Leveraging Semantic Textual Relatedness and Knowledge Graphs,"Semantic Textual Relatedness (STR) captures nuanced relationships between
texts that extend beyond superficial lexical similarity. In this study, we
investigate STR in the context of job title matching - a key challenge in
resume recommendation systems, where overlapping terms are often limited or
misleading. We introduce a self-supervised hybrid architecture that combines
dense sentence embeddings with domain-specific Knowledge Graphs (KGs) to
improve both semantic alignment and explainability. Unlike previous work that
evaluated models on aggregate performance, our approach emphasizes data
stratification by partitioning the STR score continuum into distinct regions:
low, medium, and high semantic relatedness. This stratified evaluation enables
a fine-grained analysis of model performance across semantically meaningful
subspaces. We evaluate several embedding models, both with and without KG
integration via graph neural networks. The results show that fine-tuned SBERT
models augmented with KGs produce consistent improvements in the high-STR
region, where the RMSE is reduced by 25% over strong baselines. Our findings
highlight not only the benefits of combining KGs with text embeddings, but also
the importance of regional performance analysis in understanding model
behavior. This granular approach reveals strengths and weaknesses hidden by
global metrics, and supports more targeted model selection for use in Human
Resources (HR) systems and applications where fairness, explainability, and
contextual matching are essential.",http://arxiv.org/pdf/2509.09522v1
2509.09521v1,Coarsening model of chromosomal crossover placement,"Chromosomal crossovers play a crucial role in meiotic cell division, as they
ensure proper chromosome segregation and increase genetic variability.
Experiments have consistently revealed two key observations across species: (i)
the number of crossovers per chromosome is typically small, but at least one,
and (ii) crossovers on the same chromosome are subject to interference, i.e.,
they are more separated than expected by chance. These observations can be
explained by a recently proposed coarsening model, where the dynamics of
droplets associated with chromosomes designate crossovers. We provide a
comprehensive analysis of the coarsening model, which we also extend by
including material exchanges between droplets, the synaptonemal complex, and
the nucleoplasm. We derive scaling laws for the crossover count, which allows
us to analyze data across species. Moreover, our model provides a coherent
explanation of experimental data across mutants, including the wild-type and
zyp1-mutant of A. thaliana. Consequently, the extended coarsening model
provides a solid framework for investigating the underlying mechanisms of
crossover placement.",http://arxiv.org/pdf/2509.09521v1
2509.09518v1,Microlocal analysis of the non-relativistic limit of the Klein--Gordon equation: Estimates,"This is the more technical half of a two-part work in which we introduce a
robust microlocal framework for analyzing the non-relativistic limit of
relativistic wave equations with time-dependent coefficients, focusing on the
Klein--Gordon equation. Two asymptotic regimes in phase space are relevant to
the non-relativistic limit: one corresponding to what physicists call
``natural'' units, in which the PDE is approximable by the free Klein--Gordon
equation, and a low-frequency regime in which the equation is approximable by
the usual Schrodinger equation. Combining the analyses in the two regimes gives
global estimates which are uniform as the speed of light goes to infinity. The
companion paper gives applications. Our main technical tools are three new
pseudodifferential calculi, $\Psi_{\natural}$ (a variant of the semiclassical
scattering calculus), $\Psi_{\natural\mathrm{res}}$, and
$\Psi_{\natural2\mathrm{res}}$, the latter two of which are created by ``second
microlocalizing'' the first at certain locations. This paper and the companion
paper can be read in either order, since the latter treats the former as a
black box.",http://arxiv.org/pdf/2509.09518v1
2509.09513v1,Explainable AI for Accelerated Microstructure Imaging: A SHAP-Guided Protocol on the Connectome 2.0 scanner,"The diffusion MRI Neurite Exchange Imaging model offers a promising framework
for probing gray matter microstructure by estimating parameters such as
compartment sizes, diffusivities, and inter-compartmental water exchange time.
However, existing protocols require long scan times. This study proposes a
reduced acquisition scheme for the Connectome 2.0 scanner that preserves model
accuracy while substantially shortening scan duration. We developed a
data-driven framework using explainable artificial intelligence with a guided
recursive feature elimination strategy to identify an optimal 8-feature subset
from a 15-feature protocol. The performance of this optimized protocol was
validated in vivo and benchmarked against the full acquisition and alternative
reduction strategies. Parameter accuracy, preservation of anatomical contrast,
and test-retest reproducibility were assessed. The reduced protocol yielded
parameter estimates and cortical maps comparable to the full protocol, with low
estimation errors in synthetic data and minimal impact on test-retest
variability. Compared to theory-driven and heuristic reduction schemes, the
optimized protocol demonstrated superior robustness, reducing the deviation in
water exchange time estimates by over two-fold. In conclusion, this hybrid
optimization framework enables viable imaging of neurite exchange in 14 minutes
without loss of parameter fidelity. This approach supports the broader
application of exchange-sensitive diffusion magnetic resonance imaging in
neuroscience and clinical research, and offers a generalizable method for
designing efficient acquisition protocols in biophysical parameter mapping.",http://arxiv.org/pdf/2509.09513v1
2509.09510v1,"Cognitive Affordances in Visualization: Related Constructs, Design Factors, and Framework","Classically, affordance research investigates how the shape of objects
communicates actions to potential users. Cognitive affordances, a subset of
this research, characterize how the design of objects influences cognitive
actions, such as information processing. Within visualization, cognitive
affordances inform how graphs' design decisions communicate information to
their readers. Although several related concepts exist in visualization, a
formal translation of affordance theory to visualization is still lacking. In
this paper, we review and translate affordance theory to visualization by
formalizing how cognitive affordances operate within a visualization context.
We also review common methods and terms, and compare related constructs to
cognitive affordances in visualization. Based on a synthesis of research from
psychology, human computer interaction, and visualization, we propose a
framework of cognitive affordances in visualization that enumerates design
decisions and reader characteristics that influence a visualization's hierarchy
of communicated information. Finally, we demonstrate how this framework can
guide the evaluation and redesign of visualizations.",http://arxiv.org/pdf/2509.09510v1
2509.09506v1,Frozen differential scattering in reconfigurable complex media,"The sensitivity of transmission to the input wavefront is a hallmark feature
of complex media and the basis for wavefront shaping techniques. Yet,
intriguing special cases exist in which the output wavefront is ""frozen""
(agnostic to the input wavefront). This happens when special structure in the
complex medium collapses the rank of its transmission matrix to unity. Here, we
unveil that an analogous phenomenon exists more universally for differential
scattering (including reflection) in reconfigurable complex media.
Specifically, for a localized perturbation, the differential scattering matrix
of any complex medium has rank one. One consequence is that the differential
output signal is perfectly coherent irrespective of the input wavefront's
coherence. Moreover, the thermal noise emitted into the frozen differential
output mode has a particular structure that can be exploited for thermal noise
management. We experimentally evidence frozen differential scattering in a
rich-scattering wireless link parametrized by a programmable meta-atom. Then,
we demonstrate ""customized freezing"" by optimizing the configuration of
additional programmable meta-atoms that parametrize the wireless link, as
envisioned for 6G networks. We impose particular shapes of the frozen
differential output mode, and maximize its signal-to-thermal-noise ratio.
Potential applications include filtering and stabilization of differential
wavefronts, as well as imaging, sensing, and communication in complex media.",http://arxiv.org/pdf/2509.09506v1
2509.09504v1,YSES 2b is a background star: Differential astrometric M-dwarf measurements in time,"We wish to confirm the nature of YSES 2b, a purportedly faint companion of
the young star YSES 2. We used on-sky observations from SPHERE and GRAVITY to
measure the astrometric position of 2b with respect to the star YSES 2, and
examined the competing hypotheses of (i) a bound substellar companion versus
(ii) a distant unrelated background source with a non-zero proper motion. YSES
2b appears to be a late-type M-dwarf star over 2 kiloparsecs behind the star
YSES 2. It has a transverse velocity of about 300 km/s and is located within
one of the spiral arms of the Galaxy. The main discriminant was multiple epochs
of GRAVITY astrometry that identified the sub-milliarcsecond parallactic motion
of the star.",http://arxiv.org/pdf/2509.09504v1
2509.09501v1,Region-Wise Correspondence Prediction between Manga Line Art Images,"Understanding region-wise correspondence between manga line art images is a
fundamental task in manga processing, enabling downstream applications such as
automatic line art colorization and in-between frame generation. However, this
task remains largely unexplored, especially in realistic scenarios without
pre-existing segmentation or annotations. In this paper, we introduce a novel
and practical task: predicting region-wise correspondence between raw manga
line art images without any pre-existing labels or masks. To tackle this
problem, we divide each line art image into a set of patches and propose a
Transformer-based framework that learns patch-level similarities within and
across images. We then apply edge-aware clustering and a region matching
algorithm to convert patch-level predictions into coherent region-level
correspondences. To support training and evaluation, we develop an automatic
annotation pipeline and manually refine a subset of the data to construct
benchmark datasets. Experiments on multiple datasets demonstrate that our
method achieves high patch-level accuracy (e.g., 96.34%) and generates
consistent region-level correspondences, highlighting its potential for
real-world manga applications.",http://arxiv.org/pdf/2509.09501v1
2509.09494v1,In-Loop Filtering Using Learned Look-Up Tables for Video Coding,"In-loop filtering (ILF) is a key technology in video coding standards to
reduce artifacts and enhance visual quality. Recently, neural network-based ILF
schemes have achieved remarkable coding gains, emerging as a powerful candidate
for next-generation video coding standards. However, the use of deep neural
networks (DNN) brings significant computational and time complexity or high
demands for dedicated hardware, making it challenging for general use. To
address this limitation, we study a practical ILF solution by adopting look-up
tables (LUTs). After training a DNN with a restricted reference range for ILF,
all possible inputs are traversed, and the output values of the DNN are cached
into LUTs. During the coding process, the filtering process is performed by
simply retrieving the filtered pixel through locating the input pixels and
interpolating between the cached values, instead of relying on heavy inference
computations. In this paper, we propose a universal LUT-based ILF framework,
termed LUT-ILF++. First, we introduce the cooperation of multiple kinds of
filtering LUTs and propose a series of customized indexing mechanisms to enable
better filtering reference perception with limited storage consumption. Second,
we propose the cross-component indexing mechanism to enable the filtering of
different color components jointly. Third, in order to make our solution
practical for coding uses, we propose the LUT compaction scheme to enable the
LUT pruning, achieving a lower storage cost of the entire solution. The
proposed framework is implemented in the VVC reference software. Experimental
results show that the proposed framework achieves on average 0.82%/2.97%/1.63%
and 0.85%/4.11%/2.06% bitrate reduction for common test sequences, under the AI
and RA configurations, respectively. Compared to DNN-based solutions, our
proposed solution has much lower time complexity and storage cost.",http://arxiv.org/pdf/2509.09494v1
2509.09489v1,Acoustic to Articulatory Speech Inversion for Children with Velopharyngeal Insufficiency,"Traditional clinical approaches for assessing nasality, such as
nasopharyngoscopy and nasometry, involve unpleasant experiences and are
problematic for children. Speech Inversion (SI), a noninvasive technique,
offers a promising alternative for estimating articulatory movement without the
need for physical instrumentation. In this study, an SI system trained on
nasalance data from healthy adults is augmented with source information from
electroglottography and acoustically derived F0, periodic and aperiodic energy
estimates as proxies for glottal control. This model achieves 16.92% relative
improvement in Pearson Product-Moment Correlation (PPMC) compared to a previous
SI system for nasalance estimation. To adapt the SI system for nasalance
estimation in children with Velopharyngeal Insufficiency (VPI), the model
initially trained on adult speech was fine-tuned using children with VPI data,
yielding an 7.90% relative improvement in PPMC compared to its performance
before fine-tuning.",http://arxiv.org/pdf/2509.09489v1
2509.09484v1,BagIt! An Adaptive Dual-Arm Manipulation of Fabric Bags for Object Bagging,"Bagging tasks, commonly found in industrial scenarios, are challenging
considering deformable bags' complicated and unpredictable nature. This paper
presents an automated bagging system from the proposed adaptive
Structure-of-Interest (SOI) manipulation strategy for dual robot arms. The
system dynamically adjusts its actions based on real-time visual feedback,
removing the need for pre-existing knowledge of bag properties. Our framework
incorporates Gaussian Mixture Models (GMM) for estimating SOI states,
optimization techniques for SOI generation, motion planning via Constrained
Bidirectional Rapidly-exploring Random Tree (CBiRRT), and dual-arm coordination
using Model Predictive Control (MPC). Extensive experiments validate the
capability of our system to perform precise and robust bagging across various
objects, showcasing its adaptability. This work offers a new solution for
robotic deformable object manipulation (DOM), particularly in automated bagging
tasks. Video of this work is available at https://youtu.be/6JWjCOeTGiQ.",http://arxiv.org/pdf/2509.09484v1
2509.09479v1,Short-term cognitive fatigue of spatial selective attention after face-to-face conversations in virtual noisy environments,"Spatial selective attention is an important asset for communication in
cocktail party situations but may be compromised by short-term cognitive
fatigue. Here we tested whether an effortful conversation in a highly
ecological setting depletes task performance in an auditory spatial selective
attention task. Young participants with normal hearing performed the task
before and after (1) having a real dyadic face-to-face conversation on a free
topic in a virtual reverberant room with simulated interfering conversations
and background babble noise at 72 dB SPL for 30 minutes, (2) passively
listening to the interfering conversations and babble noise, or (3) having the
conversation in quiet. Self-reported perceived effort and fatigue increased
after conversations in noise and passive listening relative to the reports
after conversations in quiet. In contrast to our expectations, response times
in the attention task decreased, rather than increased, after conversation in
noise and accuracy did not change systematically in any of the conditions on
the group level. Unexpectedly, we observed strong training effects between the
individual sessions in our within-subject design even after one hour of
training on a different day.",http://arxiv.org/pdf/2509.09479v1
2509.09478v1,The role of near neutron drip-line nuclei in the $r$-process,"The role of near neutron-drip-line nuclei in the rapid neutron-capture
process ($r$-process) is studied with the classical $r$-process model.
  Simulations under different astrophysical conditions ($T$, $n_n$) show that
$r$-process paths approach the neutron-drip line under low-temperature and
high-neutron-density conditions.
  A sensitivity study reveals that variations in the nuclear masses of these
exotic nuclei significantly impact the abundances of superheavy nuclei, and
lead to obvious abundance variations in the $A=110-125$, $A=175-185$, and
$A=200-205$ regions.
  By contrast, the $r$-process rare-earth peak and the $A=130,195$ peaks remain
largely unaffected.
  The nuclei that obviously impact $r$-process abundances are mainly
distributed in the region of $25\leq Z\leq 90$ and $50\leq N\leq 180$, with the
nuclei around neutron magic numbers found to be particularly important for the
$r$-process, even in the near-neutron-drip-line region.",http://arxiv.org/pdf/2509.09478v1
2509.09476v1,Bath-induced stabilization of classical non-linear response in two dimensional infrared spectroscopy,"Classical response functions have shown considerable promise in computational
2D IR modeling; however, a simple diagrammatic description, analogous to that
for open quantum systems, has been lacking. While a promising diagrammatic
approach has recently been introduced for isolated systems, the resulting
nonlinear response functions remain unstable at long times, a characteristic
feature of integrable classical systems. Here, we extend this framework to
incorporate system-bath interactions under the weak-anharmonicity approximation
and explore the resulting conditions for bath-induced stabilization. The
resulting expression for the weakly anharmonic response function is remarkably
simple and exhibits a one-to-one correspondence with the quantum counterpart in
the $\hbar\to 0$ limit, offering potential computational advantages in
extending the approach to large, multi-oscillator systems. We find that (to
lowest order in anharmonicity) the bath-induced stabilization of both linear
and nonlinear classical response functions depends sensitively on the nature of
spectral density, particularly on the balance between low-frequency and
high-frequency components. Application of this classical diagrammatic approach
to 2D IR spectroscopy of the amide I band captures the characteristic
population-time-dependent dynamics associated with spectral diffusion,
suggesting that the approach may prove useful in describing real experimental
systems at ambient temperatures.",http://arxiv.org/pdf/2509.09476v1
2509.09473v1,Mitigating Language Barriers in Education: Developing Multilingual Digital Learning Materials with Machine Translation,"The EdUKate project combines digital education, linguistics, translation
studies, and machine translation to develop multilingual learning materials for
Czech primary and secondary schools. Launched through collaboration between a
major Czech academic institution and the country's largest educational
publisher, the project is aimed at translating up to 9,000 multimodal
interactive exercises from Czech into Ukrainian, English, and German for an
educational web portal. It emphasizes the development and evaluation of a
direct Czech-Ukrainian machine translation system tailored to the educational
domain, with special attention to processing formatted content such as XML and
PDF and handling technical and scientific terminology. We present findings from
an initial survey of Czech teachers regarding the needs of non-Czech-speaking
students and describe the system's evaluation and implementation on the web
portal. All resulting applications are freely available to students, educators,
and researchers.",http://arxiv.org/pdf/2509.09473v1
