id,title,abstract,pdf_url
2509.09374v1,Diabatic quantum annealing for training energy-based generative models,"Energy-based generative models, such as restricted Boltzmann machines (RBMs),
require unbiased Boltzmann samples for effective training. Classical Markov
chain Monte Carlo methods, however, converge slowly and yield correlated
samples, making large-scale training difficult. We address this bottleneck by
applying the analytic relation between annealing schedules and effective
inverse temperature in diabatic quantum annealing. By implementing this
prescription on a quantum annealer, we obtain temperature-controlled Boltzmann
samples that enable RBM training with faster convergence and lower validation
error than classical sampling. We further identify a systematic temperature
misalignment intrinsic to analog quantum computers and propose an analytical
rescaling method that mitigates this hardware noise, thereby enhancing the
practicality of quantum annealers as Boltzmann samplers. In our method, the
model's connectivity is set directly by the qubit connectivity, transforming
the computational complexity inherent in classical sampling into a requirement
on quantum hardware. This shift allows the approach to extend naturally from
RBMs to fully connected Boltzmann machines, opening opportunities inaccessible
to classical training methods.",http://arxiv.org/pdf/2509.09374v1
2509.09373v1,Channel Estimation and Analog Precoding for Pixel-based Fluid-Antenna-Assisted Multiuser MIMO-OFDM Systems,"Pixel-based fluid antennas provide enhanced multiplexing gains and quicker
radiation pattern switching than traditional designs. However, this innovation
introduces challenges for channel estimation and analog precoding due to the
state-non-separable channel response problem. This paper explores a multiuser
MIMO-OFDM system utilizing pixel-based fluid antennas, informed by measurements
from a real-world prototype. We present a sparse channel recovery framework for
uplink channel sounding, employing an approximate separable channel response
model with DNN-based antenna radiation functions. We then propose two
low-complexity channel estimation algorithms that leverage orthogonal matching
pursuit and variational Bayesian inference to accurately recover channel
responses across various scattering cluster angles. These estimations enable
the prediction of composite channels for all fluid antenna states, leading to
an analog precoding scheme that optimally selects switching states for
different antennas. Our simulation results indicate that the proposed approach
significantly outperforms several baseline methods, especially in high
signal-to-noise ratio environments with numerous users.",http://arxiv.org/pdf/2509.09373v1
2509.09372v1,VLA-Adapter: An Effective Paradigm for Tiny-Scale Vision-Language-Action Model,"Vision-Language-Action (VLA) models typically bridge the gap between
perceptual and action spaces by pre-training a large-scale Vision-Language
Model (VLM) on robotic data. While this approach greatly enhances performance,
it also incurs significant training costs. In this paper, we investigate how to
effectively bridge vision-language (VL) representations to action (A). We
introduce VLA-Adapter, a novel paradigm designed to reduce the reliance of VLA
models on large-scale VLMs and extensive pre-training. To this end, we first
systematically analyze the effectiveness of various VL conditions and present
key findings on which conditions are essential for bridging perception and
action spaces. Based on these insights, we propose a lightweight Policy module
with Bridge Attention, which autonomously injects the optimal condition into
the action space. In this way, our method achieves high performance using only
a 0.5B-parameter backbone, without any robotic data pre-training. Extensive
experiments on both simulated and real-world robotic benchmarks demonstrate
that VLA-Adapter not only achieves state-of-the-art level performance, but also
offers the fast inference speed reported to date. Furthermore, thanks to the
proposed advanced bridging paradigm, VLA-Adapter enables the training of a
powerful VLA model in just 8 hours on a single consumer-grade GPU, greatly
lowering the barrier to deploying the VLA model. Project page:
https://vla-adapter.github.io/.",http://arxiv.org/pdf/2509.09372v1
2509.09370v1,Capillary Rise in Pipes with Variable Cross Section,"This work proposes an ODE model for a capillary rise in pipes with variable
cross section and compares it to the lubrication theory model. Two key
assumptions are made: (1) radius of the pipe varies with axial coordinate, and
(2) pipe's convergence angle is small. The model reduction process involves the
identification of critical parameters and simplifies the governing equations by
neglecting higher-order terms. Under appropriate scaling, it is shown that
generalized Washburn's equation for capillary rise in pipes with variable cross
section reduces to the known lubrication theory model.",http://arxiv.org/pdf/2509.09370v1
2509.09369v1,Impact of Force Noise on the Visibility of STA-Based Atom Interferometers,"In a previous work, we designed a compact atom interferometer to measure
homogeneous constant forces guiding the arms via shortcuts to adiabatic paths.
Within this scheme we drive the atom by moving spin-dependent traps, and design
a force $f(t)$ to compensate inertial terms in the moving frame. In this paper
we analyze how robust our interferometer is against some realistic noisy
deviation from the unperturbed value of the force $f(t)$. The complex overlap
of the atom wave functions for each arm of the interferometer at the final time
of the process is calculated. We demonstrate that the measure of the unknown
force will not be affected, as there will be no contribution of the error in
the phase difference of the overlap. Nevertheless, the visibility will be
reduced as the modulus will no longer be one. In addition we find the optimal
trajectories minimizing the effect of the noise in the visibility while keeping
the sensitivity of the interferometer.",http://arxiv.org/pdf/2509.09369v1
2509.09368v1,"A Fully Automatic Framework for Intracranial Pressure Grading: Integrating Keyframe Identification, ONSD Measurement and Clinical Data","Intracranial pressure (ICP) elevation poses severe threats to cerebral
function, thus necessitating monitoring for timely intervention. While lumbar
puncture is the gold standard for ICP measurement, its invasiveness and
associated risks drive the need for non-invasive alternatives. Optic nerve
sheath diameter (ONSD) has emerged as a promising biomarker, as elevated ICP
directly correlates with increased ONSD. However, current clinical practices
for ONSD measurement suffer from inconsistency in manual operation,
subjectivity in optimal view selection, and variability in thresholding,
limiting their reliability. To address these challenges, we introduce a fully
automatic two-stage framework for ICP grading, integrating keyframe
identification, ONSD measurement and clinical data. Specifically, the fundus
ultrasound video processing stage performs frame-level anatomical segmentation,
rule-based keyframe identification guided by an international consensus
statement, and precise ONSD measurement. The intracranial pressure grading
stage then fuses ONSD metrics with clinical features to enable the prediction
of ICP grades, thereby demonstrating an innovative blend of interpretable
ultrasound analysis and multi-source data integration for objective clinical
evaluation. Experimental results demonstrate that our method achieves a
validation accuracy of $0.845 \pm 0.071$ (with standard deviation from
five-fold cross-validation) and an independent test accuracy of 0.786,
significantly outperforming conventional threshold-based method ($0.637 \pm
0.111$ validation accuracy, $0.429$ test accuracy). Through effectively
reducing operator variability and integrating multi-source information, our
framework establishes a reliable non-invasive approach for clinical ICP
evaluation, holding promise for improving patient management in acute
neurological conditions.",http://arxiv.org/pdf/2509.09368v1
2509.09365v1,Plug-and-play Diffusion Models for Image Compressive Sensing with Data Consistency Projection,"We explore the connection between Plug-and-Play (PnP) methods and Denoising
Diffusion Implicit Models (DDIM) for solving ill-posed inverse problems, with a
focus on single-pixel imaging. We begin by identifying key distinctions between
PnP and diffusion models-particularly in their denoising mechanisms and
sampling procedures. By decoupling the diffusion process into three
interpretable stages: denoising, data consistency enforcement, and sampling, we
provide a unified framework that integrates learned priors with physical
forward models in a principled manner. Building upon this insight, we propose a
hybrid data-consistency module that linearly combines multiple PnP-style
fidelity terms. This hybrid correction is applied directly to the denoised
estimate, improving measurement consistency without disrupting the diffusion
sampling trajectory. Experimental results on single-pixel imaging tasks
demonstrate that our method achieves better reconstruction quality.",http://arxiv.org/pdf/2509.09365v1
2509.09360v1,MetaRAG: Metamorphic Testing for Hallucination Detection in RAG Systems,"Large Language Models (LLMs) are increasingly deployed in enterprise
applications, yet their reliability remains limited by hallucinations, i.e.,
confident but factually incorrect information. Existing detection approaches,
such as SelfCheckGPT and MetaQA, primarily target standalone LLMs and do not
address the unique challenges of Retrieval-Augmented Generation (RAG) systems,
where responses must be consistent with retrieved evidence. We therefore
present MetaRAG, a metamorphic testing framework for hallucination detection in
Retrieval-Augmented Generation (RAG) systems. MetaRAG operates in a real-time,
unsupervised, black-box setting, requiring neither ground-truth references nor
access to model internals, making it suitable for proprietary and high-stakes
domains. The framework proceeds in four stages: (1) decompose answers into
atomic factoids, (2) generate controlled mutations of each factoid using
synonym and antonym substitutions, (3) verify each variant against the
retrieved context (synonyms are expected to be entailed and antonyms
contradicted), and (4) aggregate penalties for inconsistencies into a
response-level hallucination score. Crucially for identity-aware AI, MetaRAG
localizes unsupported claims at the factoid span where they occur (e.g.,
pregnancy-specific precautions, LGBTQ+ refugee rights, or labor eligibility),
allowing users to see flagged spans and enabling system designers to configure
thresholds and guardrails for identity-sensitive queries. Experiments on a
proprietary enterprise dataset illustrate the effectiveness of MetaRAG for
detecting hallucinations and enabling trustworthy deployment of RAG-based
conversational agents. We also outline a topic-based deployment design that
translates MetaRAG's span-level scores into identity-aware safeguards; this
design is discussed but not evaluated in our experiments.",http://arxiv.org/pdf/2509.09360v1
2509.09357v1,Enhancing Oxygen Reduction Reaction on Pt-Based Electrocatalysts through Surface Decoration for Improved OH Reduction Equilibrium and Reduced H2O Adsorption,"Electrochemical energy and substance conversion devices involve complex
electrode processes, characterized by multiple charge transfer steps, competing
pathways, and various intermediates. Such complexity makes it challenging to
enhance electrocatalytic activity. The prevailing strategy typically focuses on
optimizing the geometric and electronic structures of the electrocatalysts to
align the adsorption energies of reaction intermediates with the peak of the
activity Volcano curve. In this study, we demonstrate that surface decoration
can effectively shape the micro reaction environment for the model system of
oxygen reduction reaction (ORR) on Pt electrodes. By applying a partial
hydrophobic I* adlayer on the Pt surface, we can shift the equilibrium of OH*
reduction and weaken H2O* adsorption, which significantly enhances ORR
kinetics. With in situ scan tunneling microscopy (STM) and theoretical
calculations, our study reveals the formation of isolated Pt2 surface units
situated in a hydrophobic valley surrounded by adsorbed iodine atoms. This
minimalist Pt2 active unit exhibits significantly greater activity for ORR
compared to an extended Pt surface. This strategy could pave the way for
developing highly efficient catalysts with potential applications in fuel cell
technology and metal air batteries and extension to other electrochemical
conversion reactions such as ammonia synthesis and CO2 reduction.",http://arxiv.org/pdf/2509.09357v1
2509.09356v1,Curriculum-Based Multi-Tier Semantic Exploration via Deep Reinforcement Learning,"Navigating and understanding complex and unknown environments autonomously
demands more than just basic perception and movement from embodied agents.
Truly effective exploration requires agents to possess higher-level cognitive
abilities, the ability to reason about their surroundings, and make more
informed decisions regarding exploration strategies. However, traditional RL
approaches struggle to balance efficient exploration and semantic understanding
due to limited cognitive capabilities embedded in the small policies for the
agents, leading often to human drivers when dealing with semantic exploration.
In this paper, we address this challenge by presenting a novel Deep
Reinforcement Learning (DRL) architecture that is specifically designed for
resource efficient semantic exploration. A key methodological contribution is
the integration of a Vision-Language Model (VLM) common-sense through a layered
reward function. The VLM query is modeled as a dedicated action, allowing the
agent to strategically query the VLM only when deemed necessary for gaining
external guidance, thereby conserving resources. This mechanism is combined
with a curriculum learning strategy designed to guide learning at different
levels of complexity to ensure robust and stable learning. Our experimental
evaluation results convincingly demonstrate that our agent achieves
significantly enhanced object discovery rates and develops a learned capability
to effectively navigate towards semantically rich regions. Furthermore, it also
shows a strategic mastery of when to prompt for external environmental
information. By demonstrating a practical and scalable method for embedding
common-sense semantic reasoning with autonomous agents, this research provides
a novel approach to pursuing a fully intelligent and self-guided exploration in
robotics.",http://arxiv.org/pdf/2509.09356v1
2509.09355v1,The History of Galaxy Mergers in IllustrisTNG,"The process of galaxy evolution over cosmic time is not yet fully understood,
since there is a debate on the impact of galaxy collisions on the star
formation and metallicity. The local environment of the galaxy mergers could
also have a large impact on the evolution of the galaxies, but it has not yet
been possible to examine it in detail. Modern simulations with larger capacity,
including the newest physical knowledge and new observations with JWST, help us
to answer these questions. Using the IllustrisTNG cosmological simulation, we
processed the catalogue data and the merger tree files of the TNG300-1
simulation. We calculated the galaxies average star formation rate (SFR) and
mass at redshifts between 0 < z < 15. We investigated the environment of galaxy
mergers, with the focus on the local density, and also examined how the SFR
changes in merging galaxies. We compared our findings with JWST results and
highlighted differences in the star formation rate density (SFRD) history
between the models and observations.",http://arxiv.org/pdf/2509.09355v1
2509.09349v1,Classification of Driver Behaviour Using External Observation Techniques for Autonomous Vehicles,"Road traffic accidents remain a significant global concern, with human error,
particularly distracted and impaired driving, among the leading causes. This
study introduces a novel driver behavior classification system that uses
external observation techniques to detect indicators of distraction and
impairment. The proposed framework employs advanced computer vision
methodologies, including real-time object tracking, lateral displacement
analysis, and lane position monitoring. The system identifies unsafe driving
behaviors such as excessive lateral movement and erratic trajectory patterns by
implementing the YOLO object detection model and custom lane estimation
algorithms. Unlike systems reliant on inter-vehicular communication, this
vision-based approach enables behavioral analysis of non-connected vehicles.
Experimental evaluations on diverse video datasets demonstrate the framework's
reliability and adaptability across varying road and environmental conditions.",http://arxiv.org/pdf/2509.09349v1
2509.09344v1,Lifetime of bimerons and antibimerons in two-dimensional magnets,"Soliton-based computing architectures have recently emerged as a promising
avenue to overcome fundamental limitations of conventional information
technologies, the von Neumann bottleneck. In this context, magnetic skyrmions
have been widely considered for in-situ processing devices due to their
mobility and enhanced lifetime in materials with broken inversion symmetry.
However, modern applications in non-volatile reservoir or neuromorphic
computing raise the additional demand for non-linear inter-soliton
interactions. Here we report that solitons in easy-plane magnets, such as
bimerons and antibimerons, show greater versatility and potential for
non-linear interactions than skyrmions and antiskyrmions, making them superior
candidates for this class of applications. Using first-principles and
transition state theory, we predict the coexistence of degenerate bimerons and
antibimerons at zero field in a van der Waals heterostructure
Fe$_3$GeTe$_2$/Cr$_2$Ge$_2$Te$_6$ -- an experimentally feasible system. We
demonstrate that, owing to their distinct structural symmetry, bimerons exhibit
fundamentally different behavior from skyrmions and cannot be regarded as their
in-plane counterparts, as is often assumed. This distinction leads to unique
properties of bimerons and antibimerons, which arise from the unbroken
rotational symmetry in easy-plane magnets. These range from anisotropic
soliton-soliton interactions to strong entropic effects on their lifetime,
driven by the non-local nature of thermal excitations. Our findings reveal a
broader richness of solitons in easy-plane magnets and underline their unique
potential for spintronic devices.",http://arxiv.org/pdf/2509.09344v1
2509.09343v1,Joint Optimisation of Load Balancing and Energy Efficiency for O-RAN Deployments,"Open Radio Access Network (O-RAN) architecture provides an intrinsic
capability to exploit key performance monitoring (KPM) within Radio
Intelligence Controller (RIC) to derive network optimisation through xApps.
These xApps can leverage KPM knowledge to dynamically switch on/off the
associated RUs where such a function is supported over the E2 interface.
Several existing studies employ artificial intelligence (AI)/Machine Learning
(ML) based approaches to realise such dynamic sleeping for increased energy
efficiency (EE). Nevertheless, most of these approaches rely upon offloading
user equipment (UE) to carve out a sleeping opportunity. Such an approach
inherently creates load imbalance across the network. Such load imbalance may
impact the throughput performance of offloaded UEs as they might be allocated a
lower number of physical resource blocks (PRBs). Maintaining the same PRB
allocation while addressing the EE at the network level is a challenging task.
To that end, in this article, we present a comprehensive ML-based framework for
joint optimisation of load balancing and EE for ORAN deployments. We formulate
the problem as a multi-class classification system that predictively evaluates
potential RU configurations before optimising the EE, mapping network
conditions to three load balance categories (Well Balanced, Moderately
Balanced, Imbalanced). Our multi-threshold approach (Conservative, Moderate,
Aggressive) accommodates different operational priorities between energy
savings and performance assurance. Experimental evaluation using 4.26 million
real network measurements from simulations demonstrates that our Random Forest
model achieves 98.3% F1-macro performance, representing 195% improvement over
traditional baseline strategies.",http://arxiv.org/pdf/2509.09343v1
2509.09342v1,CESRec: Constructing Pseudo Interactions for Sequential Recommendation via Conversational Feedback,"Sequential Recommendation Systems (SRS) have become essential in many
real-world applications. However, existing SRS methods often rely on
collaborative filtering signals and fail to capture real-time user preferences,
while Conversational Recommendation Systems (CRS) excel at eliciting immediate
interests through natural language interactions but neglect historical
behavior. To bridge this gap, we propose CESRec, a novel framework that
integrates the long-term preference modeling of SRS with the real-time
preference elicitation of CRS. We introduce semantic-based pseudo interaction
construction, which dynamically updates users'historical interaction sequences
by analyzing conversational feedback, generating a pseudo-interaction sequence
that seamlessly combines long-term and real-time preferences. Additionally, we
reduce the impact of outliers in historical items that deviate from users'core
preferences by proposing dual alignment outlier items masking, which identifies
and masks such items using semantic-collaborative aligned representations.
Extensive experiments demonstrate that CESRec achieves state-of-the-art
performance by boosting strong SRS models, validating its effectiveness in
integrating conversational feedback into SRS.",http://arxiv.org/pdf/2509.09342v1
2509.09339v1,Electrophoretic Beamforming in Molecular Communication: Toward Targeted Extracellular Vesicle Delivery,"Directing extracellular vesicles (EVs), such as exosomes and microvesicles,
toward specific cells is an emerging focus in nanomedicine, owing to their
natural role as carriers of proteins, RNAs, and drugs. EVs can be manipulated
by external electric fields due to their intrinsic surface charge and
biophysical properties. This study investigates the feasibility of using
extremely low-frequency electromagnetic fields to guide EV transport. A
theoretical framework based on the Fokker-Planck equation was developed and
numerically solved to model vesicle trajectories under time-harmonic drift.
Computational simulations were conducted to systematically assess the influence
of key electric field parameters, including phase, frequency, and intensity, on
vesicle displacement and trajectory. The findings demonstrate that frequencies
below 5 Hz combined with field strengths of 200-2000 V/m can induce substantial
directional control of EV motion. Moreover, enhanced directivity was achieved
through the application of multi-component electric fields. Overall, this work
establishes a theoretical foundation for the external-field-based beamforming
of nanoparticles within the framework of molecular communication.",http://arxiv.org/pdf/2509.09339v1
2509.09333v1,Toward Precise Curve Offsetting Constrained to Parametric Surfaces,"Computing offsets of curves on parametric surfaces is a fundamental yet
challenging operation in computer aided design and manufacturing. Traditional
analytical approaches suffer from time-consuming geodesic distance queries and
complex self intersection handling, while discrete methods often struggle with
precision. In this paper, we propose a totally different algorithm paradigm.
Our key insight is that by representing the source curve as a sequence of line
segment primitives, the Voronoi decomposition constrained to the parametric
surface enables localized offset computation. Specifically, the offsetting
process can be efficiently traced by independently visiting the corresponding
Voronoi cells. To address the challenge of computing the Voronoi decomposition
on parametric surfaces, we introduce two key techniques. First, we employ
intrinsic triangulation in the parameter space to accurately capture geodesic
distances. Second, instead of directly computing the surface-constrained
Voronoi decomposition, we decompose the triangulated parameter plane using a
series of plane cutting operations. Experimental results demonstrate that our
algorithm achieves superior accuracy and runtime performance compared to
existing methods. We also present several practical applications enabled by our
approach.",http://arxiv.org/pdf/2509.09333v1
