id,title,abstract,pdf_url
2509.09680v1,FLUX-Reason-6M & PRISM-Bench: A Million-Scale Text-to-Image Reasoning Dataset and Comprehensive Benchmark,"The advancement of open-source text-to-image (T2I) models has been hindered
by the absence of large-scale, reasoning-focused datasets and comprehensive
evaluation benchmarks, resulting in a performance gap compared to leading
closed-source systems. To address this challenge, We introduce FLUX-Reason-6M
and PRISM-Bench (Precise and Robust Image Synthesis Measurement Benchmark).
FLUX-Reason-6M is a massive dataset consisting of 6 million high-quality
FLUX-generated images and 20 million bilingual (English and Chinese)
descriptions specifically designed to teach complex reasoning. The image are
organized according to six key characteristics: Imagination, Entity, Text
rendering, Style, Affection, and Composition, and design explicit Generation
Chain-of-Thought (GCoT) to provide detailed breakdowns of image generation
steps. The whole data curation takes 15,000 A100 GPU days, providing the
community with a resource previously unattainable outside of large industrial
labs. PRISM-Bench offers a novel evaluation standard with seven distinct
tracks, including a formidable Long Text challenge using GCoT. Through
carefully designed prompts, it utilizes advanced vision-language models for
nuanced human-aligned assessment of prompt-image alignment and image
aesthetics. Our extensive evaluation of 19 leading models on PRISM-Bench
reveals critical performance gaps and highlights specific areas requiring
improvement. Our dataset, benchmark, and evaluation code are released to
catalyze the next wave of reasoning-oriented T2I generation. Project page:
https://flux-reason-6m.github.io/ .",http://arxiv.org/pdf/2509.09680v1
2509.09679v1,ButterflyQuant: Ultra-low-bit LLM Quantization through Learnable Orthogonal Butterfly Transforms,"Large language models require massive memory footprints, severely limiting
deployment on consumer hardware. Quantization reduces memory through lower
numerical precision, but extreme 2-bit quantization suffers from catastrophic
performance loss due to outliers in activations. Rotation-based methods such as
QuIP and QuaRot apply orthogonal transforms to eliminate outliers before
quantization, using computational invariance: $\mathbf{y} = \mathbf{Wx} =
(\mathbf{WQ}^T)(\mathbf{Qx})$ for orthogonal $\mathbf{Q}$. However, these
methods use fixed transforms--Hadamard matrices achieving optimal worst-case
coherence $\mu = 1/\sqrt{n}$--that cannot adapt to specific weight
distributions. We identify that different transformer layers exhibit distinct
outlier patterns, motivating layer-adaptive rotations rather than
one-size-fits-all approaches. We propose ButterflyQuant, which replaces
Hadamard rotations with learnable butterfly transforms parameterized by
continuous Givens rotation angles. Unlike Hadamard's discrete $\{+1, -1\}$
entries that are non-differentiable and prohibit gradient-based learning,
butterfly transforms' continuous parameterization enables smooth optimization
while guaranteeing orthogonality by construction. This orthogonal constraint
ensures theoretical guarantees in outlier suppression while achieving $O(n \log
n)$ computational complexity with only $\frac{n \log n}{2}$ learnable
parameters. We further introduce a uniformity regularization on
post-transformation activations to promote smoother distributions amenable to
quantization. Learning requires only 128 calibration samples and converges in
minutes on a single GPU--a negligible one-time cost. On LLaMA-2-7B with 2-bit
quantization, ButterflyQuant achieves 15.4 perplexity versus 22.1 for QuaRot.",http://arxiv.org/pdf/2509.09679v1
2509.09677v1,The Illusion of Diminishing Returns: Measuring Long Horizon Execution in LLMs,"Does continued scaling of large language models (LLMs) yield diminishing
returns? Real-world value often stems from the length of task an agent can
complete. We start this work by observing the simple but counterintuitive fact
that marginal gains in single-step accuracy can compound into exponential
improvements in the length of a task a model can successfully complete. Then,
we argue that failures of LLMs when simple tasks are made longer arise from
mistakes in execution, rather than an inability to reason. We propose isolating
execution capability, by explicitly providing the knowledge and plan needed to
solve a long-horizon task. We find that larger models can correctly execute
significantly more turns even when small models have 100\% single-turn
accuracy. We observe that the per-step accuracy of models degrades as the
number of steps increases. This is not just due to long-context limitations --
curiously, we observe a self-conditioning effect -- models become more likely
to make mistakes when the context contains their errors from prior turns.
Self-conditioning does not reduce by just scaling the model size. In contrast,
recent thinking models do not self-condition, and can also execute much longer
tasks in a single turn. We conclude by benchmarking frontier thinking models on
the length of task they can execute in a single turn. Overall, by focusing on
the ability to execute, we hope to reconcile debates on how LLMs can solve
complex reasoning problems yet fail at simple tasks when made longer, and
highlight the massive benefits of scaling model size and sequential test-time
compute for long-horizon tasks.",http://arxiv.org/pdf/2509.09677v1
2509.09676v1,SpatialVID: A Large-Scale Video Dataset with Spatial Annotations,"Significant progress has been made in spatial intelligence, spanning both
spatial reconstruction and world exploration. However, the scalability and
real-world fidelity of current models remain severely constrained by the
scarcity of large-scale, high-quality training data. While several datasets
provide camera pose information, they are typically limited in scale,
diversity, and annotation richness, particularly for real-world dynamic scenes
with ground-truth camera motion. To this end, we collect \textbf{SpatialVID}, a
dataset consists of a large corpus of in-the-wild videos with diverse scenes,
camera movements and dense 3D annotations such as per-frame camera poses,
depth, and motion instructions. Specifically, we collect more than 21,000 hours
of raw video, and process them into 2.7 million clips through a hierarchical
filtering pipeline, totaling 7,089 hours of dynamic content. A subsequent
annotation pipeline enriches these clips with detailed spatial and semantic
information, including camera poses, depth maps, dynamic masks, structured
captions, and serialized motion instructions. Analysis of SpatialVID's data
statistics reveals a richness and diversity that directly foster improved model
generalization and performance, establishing it as a key asset for the video
and 3D vision research community.",http://arxiv.org/pdf/2509.09676v1
2509.09674v1,SimpleVLA-RL: Scaling VLA Training via Reinforcement Learning,"Vision-Language-Action (VLA) models have recently emerged as a powerful
paradigm for robotic manipulation. Despite substantial progress enabled by
large-scale pretraining and supervised fine-tuning (SFT), these models face two
fundamental challenges: (i) the scarcity and high cost of large-scale
human-operated robotic trajectories required for SFT scaling, and (ii) limited
generalization to tasks involving distribution shift. Recent breakthroughs in
Large Reasoning Models (LRMs) demonstrate that reinforcement learning (RL) can
dramatically enhance step-by-step reasoning capabilities, raising a natural
question: Can RL similarly improve the long-horizon step-by-step action
planning of VLA? In this work, we introduce SimpleVLA-RL, an efficient RL
framework tailored for VLA models. Building upon veRL, we introduce
VLA-specific trajectory sampling, scalable parallelization, multi-environment
rendering, and optimized loss computation. When applied to OpenVLA-OFT,
SimpleVLA-RL achieves SoTA performance on LIBERO and even outperforms $\pi_0$
on RoboTwin 1.0\&2.0 with the exploration-enhancing strategies we introduce.
SimpleVLA-RL not only reduces dependence on large-scale data and enables robust
generalization, but also remarkably surpasses SFT in real-world tasks.
Moreover, we identify a novel phenomenon ``pushcut'' during RL training,
wherein the policy discovers previously unseen patterns beyond those seen in
the previous training process. Github: https://github.com/PRIME-RL/SimpleVLA-RL",http://arxiv.org/pdf/2509.09674v1
2509.09675v1,CDE: Curiosity-Driven Exploration for Efficient Reinforcement Learning in Large Language Models,"Reinforcement Learning with Verifiable Rewards (RLVR) is a powerful paradigm
for enhancing the reasoning ability of Large Language Models (LLMs). Yet
current RLVR methods often explore poorly, leading to premature convergence and
entropy collapse. To address this challenge, we introduce Curiosity-Driven
Exploration (CDE), a framework that leverages the model's own intrinsic sense
of curiosity to guide exploration. We formalize curiosity with signals from
both the actor and the critic: for the actor, we use perplexity over its
generated response, and for the critic, we use the variance of value estimates
from a multi-head architecture. Both signals serve as an exploration bonus
within the RLVR framework to guide the model. Our theoretical analysis shows
that the actor-wise bonus inherently penalizes overconfident errors and
promotes diversity among correct responses; moreover, we connect the
critic-wise bonus to the well-established count-based exploration bonus in RL.
Empirically, our method achieves an approximate +3 point improvement over
standard RLVR using GRPO/PPO on AIME benchmarks. Further analysis identifies a
calibration collapse mechanism within RLVR, shedding light on common LLM
failure modes.",http://arxiv.org/pdf/2509.09675v1
2509.09672v1,Locality in Image Diffusion Models Emerges from Data Statistics,"Among generative models, diffusion models are uniquely intriguing due to the
existence of a closed-form optimal minimizer of their training objective, often
referred to as the optimal denoiser. However, diffusion using this optimal
denoiser merely reproduces images in the training set and hence fails to
capture the behavior of deep diffusion models. Recent work has attempted to
characterize this gap between the optimal denoiser and deep diffusion models,
proposing analytical, training-free models that can generate images that
resemble those generated by a trained UNet. The best-performing method
hypothesizes that shift equivariance and locality inductive biases of
convolutional neural networks are the cause of the performance gap, hence
incorporating these assumptions into its analytical model. In this work, we
present evidence that the locality in deep diffusion models emerges as a
statistical property of the image dataset, not due to the inductive bias of
convolutional neural networks. Specifically, we demonstrate that an optimal
parametric linear denoiser exhibits similar locality properties to the deep
neural denoisers. We further show, both theoretically and experimentally, that
this locality arises directly from the pixel correlations present in natural
image datasets. Finally, we use these insights to craft an analytical denoiser
that better matches scores predicted by a deep diffusion model than the prior
expert-crafted alternative.",http://arxiv.org/pdf/2509.09672v1
2509.09666v1,Can Understanding and Generation Truly Benefit Together -- or Just Coexist?,"In this paper, we introduce an insightful paradigm through the Auto-Encoder
lens-understanding as the encoder (I2T) that compresses images into text, and
generation as the decoder (T2I) that reconstructs images from that text. Using
reconstruction fidelity as the unified training objective, we enforce the
coherent bidirectional information flow between the understanding and
generation processes, bringing mutual gains. To implement this, we propose UAE,
a novel framework for unified multimodal learning. We begin by pre-training the
decoder with large-scale long-context image captions to capture fine-grained
semantic and complex spatial relationships. We then propose Unified-GRPO via
reinforcement learning (RL), which covers three stages: (1) A cold-start phase
to gently initialize both encoder and decoder with a semantic reconstruction
loss; (2) Generation for Understanding, where the encoder is trained to
generate informative captions that maximize the decoder's reconstruction
quality, enhancing its visual understanding; (3) Understanding for Generation,
where the decoder is refined to reconstruct from these captions, forcing it to
leverage every detail and improving its long-context instruction following and
generation fidelity. For evaluation, we introduce Unified-Bench, the first
benchmark tailored to assess the degree of unification of the UMMs. A
surprising ""aha moment"" arises within the multimodal learning domain: as RL
progresses, the encoder autonomously produces more descriptive captions, while
the decoder simultaneously demonstrates a profound ability to understand these
intricate descriptions, resulting in reconstructions of striking fidelity.",http://arxiv.org/pdf/2509.09666v1
2509.09660v1,Steering MoE LLMs via Expert (De)Activation,"Mixture-of-Experts (MoE) in Large Language Models (LLMs) routes each token
through a subset of specialized Feed-Forward Networks (FFN), known as experts.
We present SteerMoE, a framework for steering MoE models by detecting and
controlling behavior-linked experts. Our detection method identifies experts
with distinct activation patterns across paired inputs exhibiting contrasting
behaviors. By selectively (de)activating such experts during inference, we
control behaviors like faithfulness and safety without retraining or modifying
weights. Across 11 benchmarks and 6 LLMs, our steering raises safety by up to
+20% and faithfulness by +27%. In adversarial attack mode, it drops safety by
-41% alone, and -100% when combined with existing jailbreak methods, bypassing
all safety guardrails and exposing a new dimension of alignment faking hidden
within experts.",http://arxiv.org/pdf/2509.09660v1
2509.09658v1,Measuring Epistemic Humility in Multimodal Large Language Models,"Hallucinations in multimodal large language models (MLLMs) -- where the model
generates content inconsistent with the input image -- pose significant risks
in real-world applications, from misinformation in visual question answering to
unsafe errors in decision-making. Existing benchmarks primarily test
recognition accuracy, i.e., evaluating whether models can select the correct
answer among distractors. This overlooks an equally critical capability for
trustworthy AI: recognizing when none of the provided options are correct, a
behavior reflecting epistemic humility. We present HumbleBench, a new
hallucination benchmark designed to evaluate MLLMs' ability to reject plausible
but incorrect answers across three hallucination types: object, relation, and
attribute. Built from a panoptic scene graph dataset, we leverage fine-grained
scene graph annotations to extract ground-truth entities and relations, and
prompt GPT-4-Turbo to generate multiple-choice questions, followed by a
rigorous manual filtering process. Each question includes a ""None of the above""
option, requiring models not only to recognize correct visual information but
also to identify when no provided answer is valid. We evaluate a variety of
state-of-the-art MLLMs -- including both general-purpose and specialized
reasoning models -- on HumbleBench and share valuable findings and insights
with the community. By incorporating explicit false-option rejection,
HumbleBench fills a key gap in current evaluation suites, providing a more
realistic measure of MLLM reliability in safety-critical settings. Our code and
dataset are released publicly and can be accessed at
https://github.com/maifoundations/HumbleBench.",http://arxiv.org/pdf/2509.09658v1
2509.09653v1,Towards A High-Performance Quantum Data Center Network Architecture,"Quantum Data Centers (QDCs) are needed to support large-scale quantum
processing for both academic and commercial applications. While large-scale
quantum computers are constrained by technological and financial barriers, a
modular approach that clusters small quantum computers offers an alternative.
This approach, however, introduces new challenges in network scalability,
entanglement generation, and quantum memory management. In this paper, we
propose a three-layer fat-tree network architecture for QDCs, designed to
address these challenges. Our architecture features a unique leaf switch and an
advanced swapping spine switch design, optimized to handle high volumes of
entanglement requests as well as a queue scheduling mechanism that efficiently
manages quantum memory to prevent decoherence. Through queuing-theoretical
models and simulations in NetSquid, we demonstrate the proposed architecture's
scalability and effectiveness in maintaining high entanglement fidelity,
offering a practical path forward for modular QDC networks.",http://arxiv.org/pdf/2509.09653v1
2509.09651v1,Retrieval-Augmented Generation for Reliable Interpretation of Radio Regulations,"We study question answering in the domain of radio regulations, a legally
sensitive and high-stakes area. We propose a telecom-specific
Retrieval-Augmented Generation (RAG) pipeline and introduce, to our knowledge,
the first multiple-choice evaluation set for this domain, constructed from
authoritative sources using automated filtering and human validation. To assess
retrieval quality, we define a domain-specific retrieval metric, under which
our retriever achieves approximately 97% accuracy. Beyond retrieval, our
approach consistently improves generation accuracy across all tested models. In
particular, while naively inserting documents without structured retrieval
yields only marginal gains for GPT-4o (less than 1%), applying our pipeline
results in nearly a 12% relative improvement. These findings demonstrate that
carefully targeted grounding provides a simple yet strong baseline and an
effective domain-specific solution for regulatory question answering. All code
and evaluation scripts, along with our derived question-answer dataset, are
available at https://github.com/Zakaria010/Radio-RAG.",http://arxiv.org/pdf/2509.09651v1
2509.09650v1,All for One: LLMs Solve Mental Math at the Last Token With Information Transferred From Other Tokens,"Large language models (LLMs) demonstrate proficiency across numerous
computational tasks, yet their inner workings remain unclear. In theory, the
combination of causal self-attention and multilayer perceptron layers allows
every token to access and compute information based on all preceding tokens. In
practice, to what extent are such operations present? In this paper, on mental
math tasks (i.e., direct math calculation via next-token prediction without
explicit reasoning), we investigate this question in three steps: inhibiting
input-specific token computations in the initial layers, restricting the routes
of information transfer across token positions in the next few layers, and
forcing all computation to happen at the last token in the remaining layers.
With two proposed techniques, Context-Aware Mean Ablation (CAMA) and
Attention-Based Peeking (ABP), we identify an All-for-One subgraph (AF1) with
high accuracy on a wide variety of mental math tasks, where meaningful
computation occurs very late (in terms of layer depth) and only at the last
token, which receives information of other tokens in few specific middle
layers. Experiments on a variety of models and arithmetic expressions show that
this subgraph is sufficient and necessary for high model performance, transfers
across different models, and works on a variety of input styles. Ablations on
different CAMA and ABP alternatives reveal their unique advantages over other
methods, which may be of independent interest.",http://arxiv.org/pdf/2509.09650v1
2509.09647v1,Reconstructing the origin of black hole mergers using sparse astrophysical models,"The astrophysical origin of binary black hole mergers discovered by LIGO and
Virgo remains uncertain. Efforts to reconstruct the processes that lead to
mergers typically rely on either astrophysical models with fixed parameters, or
continuous analytical models that can be fit to observations. Given the
complexity of astrophysical formation mechanisms, these methods typically
cannot fully take into account model uncertainties, nor can they fully capture
the underlying processes. Here, we present a merger population analysis that
can take a discrete set of simulated model distributions as its input to
interpret observations. The analysis can take into account multiple formation
scenarios as fractional contributors to the total set of observations, and can
naturally account for model uncertainties. We apply this technique to
investigate the origin of black hole mergers observed by LIGO Virgo.
Specifically, we consider a model of AGN assisted black hole merger
distributions, exploring a range of AGN parameters along with several {{SEVN}}
population synthesis models that vary in common envelope efficiency parameter
($\alpha$) and metallicity ($Z$). We estimate the posterior distributions for
AGN+SEVN models using $87$ BBH detections from the $O1--O3$ observation runs.
The inferred total merger rate is $46.2 {Gpc}^{-3} {yr}^{-1}$, with the AGN
sub-population contributing $21.2{Gpc}^{-3}{yr}^{-1}$ and the SEVN
sub-population contributing $25.0 {Gpc}^{-3} {yr}^{-1}$.",http://arxiv.org/pdf/2509.09647v1
2509.09645v1,Explaining the Reputational Risks of AI-Mediated Communication: Messages Labeled as AI-Assisted Are Viewed as Less Diagnostic of the Sender's Moral Character,"When someone sends us a thoughtful message, we naturally form judgments about
their character. But what happens when that message carries a label indicating
it was written with the help of AI? This paper investigates how the appearance
of AI assistance affects our perceptions of message senders. Adding nuance to
previous research, through two studies (N=399) featuring vignette scenarios, we
find that AI-assistance labels don't necessarily make people view senders
negatively. Rather, they dampen the strength of character signals in
communication. We show that when someone sends a warmth-signalling message
(like thanking or apologizing) without AI help, people more strongly categorize
the sender as warm. At the same time, when someone sends a coldness-signalling
message (like bragging or blaming) without assistance, people more confidently
categorize them as cold. Interestingly, AI labels weaken both these
associations: An AI-assisted apology makes the sender appear less warm than if
they had written it themselves, and an AI-assisted blame makes the sender
appear less cold than if they had composed it independently. This supports our
signal diagnosticity explanation: messages labeled as AI-assisted are viewed as
less diagnostic than messages which seem unassisted. We discuss how our
findings shed light on the causal origins of previously reported observations
in AI-Mediated Communication.",http://arxiv.org/pdf/2509.09645v1
2509.09644v1,RSMA-Enhanced Data Collection in RIS-Assisted Intelligent Consumer Transportation Systems,"This paper investigates the data collection enhancement problem in a
reconfigurable intelligent surface (RIS)-empowered intelligent consumer
transportation system (ICTS). We propose a novel framework where a data center
(DC) provides energy to pre-configured roadside unit (RSU) pairs during the
downlink stage. While in the uplink stage, these RSU pairs utilize a hybrid
rate-splitting multiple access (RSMA) and time-division multiple access (TDMA)
protocol to transmit the processed data to the DC, while simultaneously
performing local data processing using the harvested energy. Our objective is
to maximize the minimal processed data volume of the RSU pairs by jointly
optimizing the RIS downlink and uplink phase shifts, the transmit power of the
DC and RSUs, the RSU computation resource allocation, and the time slot
allocation. To address the formulated non-convex problem, we develop an
efficient iterative algorithm integrating alternating optimization and
sequential rank-one constraint relaxation methods. Extensive simulations
demonstrate that the proposed algorithm significantly outperforms baseline
schemes under diverse scenarios, validating its effectiveness in enhancing the
data processing performance for intelligent transportation applications.",http://arxiv.org/pdf/2509.09644v1
