id,title,abstract,pdf_url
2509.09289v1,Toward Quantum Enabled Solutions for Real-Time Currency Arbitrage in Financial Markets,"Currency arbitrage leverages price discrepancies in currency exchange rates
across different currency pairs to gain risk-free profits. It involves multiple
trading, where short-lived price discrepancies require real-time, high-speed
processing of vast solution space, posing challenges for classical computing.
In this work, we formulate an enhanced mathematical model for the currency
arbitrage problem by adding simple cycle preservation constraints, which
guarantee trading cycle validity and eliminate redundant or infeasible
substructures. To solve this model, we use and benchmark various solvers,
including Quantum Annealing (QA), gate-based quantum approaches such as
Variational Quantum Algorithm with Adaptive Cost Encoding (ACE), as well as
classical solvers such as Gurobi and classical meta heuristics such as Tabu
Search (TS). We propose a classical multi-bit swap post-processing to improve
the solution generated by ACE. Using real-world currency exchange data, we
compare these methods in terms of both arbitrage profit and execution time, the
two key performance metrics. Our results give insight into the current
capabilities and limitations of quantum methods for real-time financial use
cases.",http://arxiv.org/pdf/2509.09289v1
2509.09286v1,Visual Programmability: A Guide for Code-as-Thought in Chart Understanding,"Chart understanding presents a critical test to the reasoning capabilities of
Vision-Language Models (VLMs). Prior approaches face critical limitations: some
rely on external tools, making them brittle and constrained by a predefined
toolkit, while others fine-tune specialist models that often adopt a single
reasoning strategy, such as text-based chain-of-thought (CoT). The intermediate
steps of text-based reasoning are difficult to verify, which complicates the
use of reinforcement-learning signals that reward factual accuracy. To address
this, we propose a Code-as-Thought (CaT) approach to represent the visual
information of a chart in a verifiable, symbolic format. Our key insight is
that this strategy must be adaptive: a fixed, code-only implementation
consistently fails on complex charts where symbolic representation is
unsuitable. This finding leads us to introduce Visual Programmability: a
learnable property that determines if a chart-question pair is better solved
with code or direct visual analysis. We implement this concept in an adaptive
framework where a VLM learns to choose between the CaT pathway and a direct
visual reasoning pathway. The selection policy of the model is trained with
reinforcement learning using a novel dual-reward system. This system combines a
data-accuracy reward to ground the model in facts and prevent numerical
hallucination, with a decision reward that teaches the model when to use each
strategy, preventing it from defaulting to a single reasoning mode. Experiments
demonstrate strong and robust performance across diverse chart-understanding
benchmarks. Our work shows that VLMs can be taught not only to reason but also
how to reason, dynamically selecting the optimal reasoning pathway for each
task.",http://arxiv.org/pdf/2509.09286v1
2509.09284v1,Tree-OPO: Off-policy Monte Carlo Tree-Guided Advantage Optimization for Multistep Reasoning,"Recent advances in reasoning with large language models (LLMs) have shown the
effectiveness of Monte Carlo Tree Search (MCTS) for generating high-quality
intermediate trajectories, particularly in math and symbolic domains. Inspired
by this, we explore how MCTS-derived trajectories, traditionally used for
training value or reward models, can be repurposed to improve policy
optimization in preference-based reinforcement learning (RL). Specifically, we
focus on Group Relative Policy Optimization (GRPO), a recent algorithm that
enables preference-consistent policy learning without value networks. We
propose a staged GRPO training paradigm where completions are derived from
partially revealed MCTS rollouts, introducing a novel tree-structured setting
for advantage estimation. This leads to a rich class of prefix-conditioned
reward signals, which we analyze theoretically and empirically. Our initial
results indicate that while structured advantage estimation can stabilize
updates and better reflect compositional reasoning quality, challenges such as
advantage saturation and reward signal collapse remain. We propose heuristic
and statistical solutions to mitigate these issues and discuss open challenges
for learning under staged or tree-like reward structures.",http://arxiv.org/pdf/2509.09284v1
2509.09282v1,On the Relation of Characteristic Modes of Different Conducting Structures,"A formalism is derived to analyze the scattering of a conducting structure
based on the characteristic modes of another structure whose surface is a
superset of the first structure. This enables the analysis and comparison of
different structures using a common basis of characteristic modes.
Additionally, it is shown that the scattering matrices and perturbation
matrices are no longer diagonal in these cases. Based on this, a modal
transformation matrix is defined to describe the mapping between the
characteristic fields and the weighting coefficients of the two structures.
This matrix enables the conversion of the perturbation matrices in different
bases. Finally, two examples are provided along with a discussion of some
aspects of the theory. The first example aims to validate and illustrate the
formalism. The second example shows how the formalism can be applied in the
design process of an antenna element that is gradually modified, starting from
a base structure.",http://arxiv.org/pdf/2509.09282v1
2509.09278v1,Data Driven Discovery of Emergent Dynamics in Reaction Diffusion Systems from Sparse and Noisy Observations,"Data-driven discovery of emergent dynamics is gaining popularity,
particularly in the context of reaction-diffusion systems. These systems are
widely studied across various fields, including neuroscience, ecology,
epidemiology, and several other subject areas that deal with emergent dynamics.
A current challenge in the discovery process relates to system identification
when there is no prior knowledge of the underlying physics. We attempt to
address this challenge by learning Soft Artificial Life (Soft ALife) models,
such as Agent-based and Cellular Automata (CA) models, from observed data for
reaction-diffusion systems. In this paper, we present findings on the
applicability of a conceptual framework, the Data-driven Rulesets for Soft
Artificial Life (DRSALife) model, to learn Soft ALife rulesets that accurately
represent emergent dynamics in a reaction-diffusion system from observed data.
This model has demonstrated promising results for Elementary CA Rule 30, Game
of Life, and Vicsek Flocking problems in recent work. To our knowledge, this is
one of the few studies that explore machine-based Soft ALife ruleset learning
and system identification for reaction-diffusion dynamics without any prior
knowledge of the underlying physics. Moreover, we provide comprehensive
findings from experiments investigating the potential effects of using noisy
and sparse observed datasets on learning emergent dynamics. Additionally, we
successfully identify the structure and parameters of the underlying partial
differential equations (PDEs) representing these dynamics. Experimental results
demonstrate that the learned models are able to predict the emergent dynamics
with good accuracy (74%) and exhibit quite robust performance when subjected to
Gaussian noise and temporal sparsity.",http://arxiv.org/pdf/2509.09278v1
2509.09275v1,Neural Transformer Backflow for Solving Momentum-Resolved Ground States of Strongly Correlated Materials,"Strongly correlated materials, such as twisted transition-metal
dichalcogenide homobilayers, host a variety of exotic quantum phases but remain
notoriously difficult to solve due to strong interactions. We introduce a
powerful neural network ansatz, Neural Transformer Backflow (NTB), formulated
within a multi-band projection framework. It naturally enforces momentum
conservation and enables efficient calculations of momentum-resolved ground
states. NTB attains high accuracy on small systems and scales to higher bands
and larger system sizes far beyond the reach of exact diagonalization. By
evaluating observables such as the structure factor and momentum distribution,
we show that NTB captures diverse correlated states in tMoTe$_2$, including
charge density waves, fractional Chern insulators, and anomalous Hall Fermi
liquids, within a unified framework. Our approach paves the way for
understanding and discovering novel phases of matter in strongly correlated
materials.",http://arxiv.org/pdf/2509.09275v1
2509.09272v1,Fusing Knowledge and Language: A Comparative Study of Knowledge Graph-Based Question Answering with LLMs,"Knowledge graphs, a powerful tool for structuring information through
relational triplets, have recently become the new front-runner in enhancing
question-answering systems. While traditional Retrieval Augmented Generation
(RAG) approaches are proficient in fact-based and local context-based
extraction from concise texts, they encounter limitations when addressing the
thematic and holistic understanding of complex, extensive texts, requiring a
deeper analysis of both text and context. This paper presents a comprehensive
technical comparative study of three different methodologies for constructing
knowledge graph triplets and integrating them with Large Language Models (LLMs)
for question answering: spaCy, Stanford CoreNLP-OpenIE, and GraphRAG, all
leveraging open source technologies. We evaluate the effectiveness,
feasibility, and adaptability of these methods by analyzing their capabilities,
state of development, and their impact on the performance of LLM-based question
answering. Experimental results indicate that while OpenIE provides the most
comprehensive coverage of triplets, GraphRAG demonstrates superior reasoning
abilities among the three. We conclude with a discussion on the strengths and
limitations of each method and provide insights into future directions for
improving knowledge graph-based question answering.",http://arxiv.org/pdf/2509.09272v1
2509.09269v1,The role of communication delays in the optimal control of spatially invariant systems,"We study optimal proportional feedback controllers for spatially invariant
systems when the controller has access to delayed state measurements received
from different spatial locations. We analyze how delays affect the spatial
locality of the optimal feedback gain leveraging the problem decoupling in the
spatial frequency domain. For the cases of expensive control and small delay,
we provide exact expressions of the optimal controllers in the limit for
infinite control weight and vanishing delay, respectively. In the expensive
control regime, the optimal feedback control law decomposes into a delay-aware
filtering of the delayed state and the optimal controller in the delay-free
setting. Under small delays, the optimal controller is a perturbation of the
delay-free one which depends linearly on the delay. We illustrate our
analytical findings with a reaction-diffusion process over the real line and a
multi-agent system coupled through circulant matrices, showing that delays
reduce the effectiveness of optimal feedback control and may require each
subsystem within a distributed implementation to communicate with farther-away
locations.",http://arxiv.org/pdf/2509.09269v1
2509.09268v1,Ultrafast probing of isotope-induced explciit symmetry breaking in ethylene,"Symmetry governs nature's law, yet many of the natural phenomena occur due to
the breakdown of symmetry. Here, we show how isotope-induced inversion symmetry
breaking influences ultrafast photoisomerization processes in ethylene. Using
extreme ultraviolet pump-near infrared probe time-of-flight mass spectrometry,
we find that replacing one of the carbon atoms in ethylene with a 13C isotope
leads to twice-faster structural relaxation via ethylene-ethylidene
isomerization in the photo-excited molecular cation. Advanced trajectory
surface hopping calculations incorporating the nuclear symmetry of the
molecular systems, reveal that it arises from the mixing of different normal
modes in the isotope-substituted species, interactions otherwise forbidden by
symmetry. Although the mixing does not alter the symmetry of the electronic
Hamiltonian, it modifies that of the nuclear Hamiltonian, causing explicit
symmetry breaking. This facilitates efficient intra-molecular vibrational
energy redistribution, lowering the isomerization yield. Our findings offer
opportunities to use isotope-induced nuclear symmetry breaking to control the
outcome of light-molecule interactions across ultrafast timescales.",http://arxiv.org/pdf/2509.09268v1
2509.09265v1,Harnessing Uncertainty: Entropy-Modulated Policy Gradients for Long-Horizon LLM Agents,"In long-horizon tasks, recent agents based on Large Language Models (LLMs)
face a significant challenge that sparse, outcome-based rewards make it
difficult to assign credit to intermediate steps. Previous methods mainly focus
on creating dense reward signals to guide learning, either through traditional
reinforcement learning techniques like inverse reinforcement learning or by
using Process Reward Models for step-by-step feedback. In this paper, we
identify a fundamental problem in the learning dynamics of LLMs: the magnitude
of policy gradients is inherently coupled with the entropy, which leads to
inefficient small updates for confident correct actions and potentially
destabilizes large updates for uncertain ones. To resolve this, we propose
Entropy-Modulated Policy Gradients (EMPG), a framework that re-calibrates the
learning signal based on step-wise uncertainty and the final task outcome. EMPG
amplifies updates for confident correct actions, penalizes confident errors,
and attenuates updates from uncertain steps to stabilize exploration. We
further introduce a bonus term for future clarity that encourages agents to
find more predictable solution paths. Through comprehensive experiments on
three challenging agent tasks, WebShop, ALFWorld, and Deep Search, we
demonstrate that EMPG achieves substantial performance gains and significantly
outperforms strong policy gradient baselines. Project page is at
https://empgseed-seed.github.io/",http://arxiv.org/pdf/2509.09265v1
2509.09264v1,Improved Riemannian potato field: an Automatic Artifact Rejection Method for EEG,"Electroencephalography (EEG) signal cleaning has long been a critical
challenge in the research community. The presence of artifacts can
significantly degrade EEG data quality, complicating analysis and potentially
leading to erroneous interpretations. While various artifact rejection methods
have been proposed, the gold standard remains manual visual inspection by human
experts-a process that is time-consuming, subjective, and impractical for
large-scale EEG studies. Existing techniques are often hindered by a strong
reliance on manual hyperparameter tuning, sensitivity to outliers, and high
computational costs. In this paper, we introduce the improved Riemannian Potato
Field (iRPF), a fast and fully automated method for EEG artifact rejection that
addresses key limitations of current approaches. We evaluate iRPF against
several state-of-the-art artifact rejection methods, using two publicly
available EEG databases, labeled for various artifact types, comprising 226 EEG
recordings. Our results demonstrate that iRPF outperforms all competitors
across multiple metrics, with gains of up to 22% in recall, 102% in
specificity, 54% in precision, and 24% in F1-score, compared to Isolation
Forest, Autoreject, Riemannian Potato, and Riemannian Potato Field,
respectively. Statistical analysis confirmed the significance of these
improvements (p < 0.001) with large effect sizes (Cohen's d > 0.8) in most
comparisons. Additionally, on a typical EEG recording iRPF performs artifact
cleaning in under 8 milliseconds per epoch using a standard laptop,
highlighting its efficiency for large-scale EEG data processing and real-time
applications. iRPF offers a robust and data-driven artifact rejection solution
for high-quality EEG pre-processing in brain-computer interfaces and clinical
neuroimaging applications.",http://arxiv.org/pdf/2509.09264v1
2509.09263v1,DATE: Dynamic Absolute Time Enhancement for Long Video Understanding,"Long video understanding remains a fundamental challenge for multimodal large
language models (MLLMs), particularly in tasks requiring precise temporal
reasoning and event localization. Existing approaches typically adopt uniform
frame sampling and rely on implicit position encodings to model temporal order.
However, these methods struggle with long-range dependencies, leading to
critical information loss and degraded temporal comprehension. In this paper,
we propose Dynamic Absolute Time Enhancement (DATE) that enhances temporal
awareness in MLLMs through the Timestamp Injection Mechanism (TIM) and a
semantically guided Temporal-Aware Similarity Sampling (TASS) strategy.
Specifically, we interleave video frame embeddings with textual timestamp
tokens to construct a continuous temporal reference system. We further
reformulate the video sampling problem as a vision-language retrieval task and
introduce a two-stage algorithm to ensure both semantic relevance and temporal
coverage: enriching each query into a descriptive caption to better align with
the vision feature, and sampling key event with a similarity-driven temporally
regularized greedy strategy. Our method achieves remarkable improvements w.r.t.
absolute time understanding and key event localization, resulting in
state-of-the-art performance among 7B and 72B models on hour-long video
benchmarks. Particularly, our 7B model even exceeds many 72B models on some
benchmarks.",http://arxiv.org/pdf/2509.09263v1
2509.09258v1,Intermittent chaos in an optomechanical resonator,"Chaos is a fundamental phenomenon in nonlinear dynamics, manifesting as
irregular and unpredictable behavior across various physical systems. Among the
diverse routes to chaos, intermittent chaos is a distinct transition pathway,
characterized by the temporal or spatial alternation between periodic and
chaotic motions. Here, we experimentally demonstrate, for the first time,
optomechanically induced intermittent chaos in an optical
whispering-gallery-mode microresonator. Specifically, the system evolves from
stable periodic oscillation through an intermittent-chaos regime before fully
developing into chaotic motion. As system parameters vary, the proportion of
chaotic motion in the time-domain increases asymptotically until chaotic
dynamics dominates entirely. Moreover, it is counterintuitive that,
intermittent chaos can act as noise of a favorable intensity compared with
purely periodic or fully chaotic states, and enhance rather than reduce
system's responses in nonlinear ultrasonic detection. These findings not only
deepen the comprehensive understanding of chaos formation but also broaden its
potential applications in high-precision sensing and information processing.",http://arxiv.org/pdf/2509.09258v1
2509.09254v1,Towards Better Dental AI: A Multimodal Benchmark and Instruction Dataset for Panoramic X-ray Analysis,"Recent advances in large vision-language models (LVLMs) have demonstrated
strong performance on general-purpose medical tasks. However, their
effectiveness in specialized domains such as dentistry remains underexplored.
In particular, panoramic X-rays, a widely used imaging modality in oral
radiology, pose interpretative challenges due to dense anatomical structures
and subtle pathological cues, which are not captured by existing medical
benchmarks or instruction datasets. To this end, we introduce MMOral, the first
large-scale multimodal instruction dataset and benchmark tailored for panoramic
X-ray interpretation. MMOral consists of 20,563 annotated images paired with
1.3 million instruction-following instances across diverse task types,
including attribute extraction, report generation, visual question answering,
and image-grounded dialogue. In addition, we present MMOral-Bench, a
comprehensive evaluation suite covering five key diagnostic dimensions in
dentistry. We evaluate 64 LVLMs on MMOral-Bench and find that even the
best-performing model, i.e., GPT-4o, only achieves 41.45% accuracy, revealing
significant limitations of current models in this domain. To promote the
progress of this specific domain, we also propose OralGPT, which conducts
supervised fine-tuning (SFT) upon Qwen2.5-VL-7B with our meticulously curated
MMOral instruction dataset. Remarkably, a single epoch of SFT yields
substantial performance enhancements for LVLMs, e.g., OralGPT demonstrates a
24.73% improvement. Both MMOral and OralGPT hold significant potential as a
critical foundation for intelligent dentistry and enable more clinically
impactful multimodal AI systems in the dental field. The dataset, model,
benchmark, and evaluation suite are available at
https://github.com/isbrycee/OralGPT.",http://arxiv.org/pdf/2509.09254v1
2509.09245v1,Jupiter: Enhancing LLM Data Analysis Capabilities via Notebook and Inference-Time Value-Guided Search,"Large language models (LLMs) have shown great promise in automating data
science workflows, but existing models still struggle with multi-step reasoning
and tool use, which limits their effectiveness on complex data analysis tasks.
To address this, we propose a scalable pipeline that extracts high-quality,
tool-based data analysis tasks and their executable multi-step solutions from
real-world Jupyter notebooks and associated data files. Using this pipeline, we
introduce NbQA, a large-scale dataset of standardized task-solution pairs that
reflect authentic tool-use patterns in practical data science scenarios. To
further enhance multi-step reasoning, we present Jupiter, a framework that
formulates data analysis as a search problem and applies Monte Carlo Tree
Search (MCTS) to generate diverse solution trajectories for value model
learning. During inference, Jupiter combines the value model and node visit
counts to efficiently collect executable multi-step plans with minimal search
steps. Experimental results show that Qwen2.5-7B and 14B-Instruct models on
NbQA solve 77.82% and 86.38% of tasks on InfiAgent-DABench,
respectively-matching or surpassing GPT-4o and advanced agent frameworks.
Further evaluations demonstrate improved generalization and stronger tool-use
reasoning across diverse multi-step reasoning tasks.",http://arxiv.org/pdf/2509.09245v1
2509.09241v1,A novel method and dataset for depth-guided image deblurring from smartphone Lidar,"Modern smartphones are equipped with Lidar sensors providing depth-sensing
capabilities. Recent works have shown that this complementary sensor allows to
improve various tasks in image processing, including deblurring. However, there
is a current lack of datasets with realistic blurred images and paired mobile
Lidar depth maps to further study the topic. At the same time, there is also a
lack of blind zero-shot methods that can deblur a real image using the depth
guidance without requiring extensive training sets of paired data. In this
paper, we propose an image deblurring method based on denoising diffusion
models that can leverage the Lidar depth guidance and does not require training
data with paired Lidar depth maps. We also present the first dataset with real
blurred images with corresponding Lidar depth maps and sharp ground truth
images, acquired with an Apple iPhone 15 Pro, for the purpose of studying
Lidar-guided deblurring. Experimental results on this novel dataset show that
Lidar guidance is effective and the proposed method outperforms
state-of-the-art deblurring methods in terms of perceptual quality.",http://arxiv.org/pdf/2509.09241v1
